<?xml version="1.0" encoding="ISO-8859-1"?><!-- edited with XMLSPY v2004 rel. 4 U (http://www.xmlspy.com) by tester (altova) --><!--W3C Schema generated by XMLSPY v2004 rel. 4 U (http://www.xmlspy.com)--><xs:schema elementFormDefault="qualified" xmlns:xs="http://www.w3.org/2001/XMLSchema">  <xs:element name="Anrufliste">    <xs:complexType>      <xs:sequence>        <xs:element name="Anruf" maxOccurs="unbounded">          <xs:complexType>            <xs:sequence>              <xs:element name="Beginn" type="xs:string"/>              <xs:element name="Dauer" type="xs:byte"/>              <xs:element name="Preis" type="xs:byte"/>              <xs:element name="Tarif">                <xs:complexType>                  <xs:simpleContent>                    <xs:extension base="xs:string">                      <xs:attribute name="Nr" type="xs:byte" use="required"/>                    </xs:extension>                  </xs:simpleContent>                </xs:complexType>              </xs:element>              <!-- Element Von -->              <xs:element name="Von">                <xs:complexType>                  <xs:sequence>                    <xs:element ref="Name"/>                    <xs:element ref="Stadt"/>                  </xs:sequence>                  <xs:attribute name="Nr" type="xs:byte" use="required"/>                </xs:complexType>              </xs:element>              <!-- Element Nach -->              <xs:element name="Nach">                <xs:complexType>                  <xs:sequence>                    <xs:element ref="Name"/>                    <xs:element ref="Stadt"/>                  </xs:sequence>                  <xs:attribute name="Nr" type="xs:byte" use="required"/>                </xs:complexType>              </xs:element>            </xs:sequence>            <xs:attribute name="Nr" type="xs:short" use="required"/>            <xs:attribute name="Typ" type="xs:string" use="required"/>          </xs:complexType>        </xs:element>      </xs:sequence>    </xs:complexType>  </xs:element>    <!-- Globale Elemente -->  <xs:element name="Name" type="xs:string"/>  <xs:element name="Stadt" type="xs:string"/></xs:schema>